-- Test: assign() creates rules that denormalize roles
CREATE EXTENSION letter;
WARNING:  letter: library loaded on demand, not preloaded
DETAIL:  Read enforcement is a planner hook; sessions that never call a letter function will not have it.
HINT:  Add letter to shared_preload_libraries (or session_preload_libraries).
SET letter.enforce_reads = off;   -- this test is not about the read hook
-- Set up application tables
CREATE TABLE users (
    id uuid PRIMARY KEY DEFAULT gen_random_uuid(),
    name TEXT NOT NULL
);
CREATE TABLE projects (
    id uuid PRIMARY KEY DEFAULT gen_random_uuid(),
    name TEXT NOT NULL
);
CREATE TABLE team_members (
    id uuid PRIMARY KEY DEFAULT gen_random_uuid(),
    user_id uuid NOT NULL REFERENCES users(id) ON DELETE CASCADE,
    project_id uuid NOT NULL REFERENCES projects(id) ON DELETE CASCADE,
    role TEXT NOT NULL
);
-- ============================================================
-- Test 1: Scoped assignment with role from a column
-- "rows in team_members assign the role in the 'role' column, scoped to projects"
-- ============================================================
SET letter.bypass = on;
SELECT letter.assign('public.team_members', 'user_id', role_column := 'role', scope := 'public.projects');
 assign 
--------
 t
(1 row)

RESET letter.bypass;
-- Verify the assignment rule was created
SELECT table_name, scope_table, user_column, role, role_column
    FROM letter.membership_rules;
  table_name  | scope_table | user_column | role | role_column 
--------------+-------------+-------------+------+-------------
 team_members | projects    | user_id     |      | role
(1 row)

-- Insert test data
INSERT INTO users (id, name) VALUES
    ('a0000000-0000-0000-0000-000000000001', 'Alice'),
    ('a0000000-0000-0000-0000-000000000002', 'Bob');
INSERT INTO projects (id, name) VALUES
    ('b0000000-0000-0000-0000-000000000001', 'Project Alpha'),
    ('b0000000-0000-0000-0000-000000000002', 'Project Beta');
-- Adding a team member should create a role
INSERT INTO team_members (user_id, project_id, role) VALUES
    ('a0000000-0000-0000-0000-000000000001', 'b0000000-0000-0000-0000-000000000001', 'editor');
SELECT role, user_id, scope_table, scope_id FROM letter.memberships ORDER BY role;
  role  |               user_id                | scope_table |               scope_id               
--------+--------------------------------------+-------------+--------------------------------------
 editor | a0000000-0000-0000-0000-000000000001 | projects    | b0000000-0000-0000-0000-000000000001
(1 row)

SELECT count(*) AS role_assignment_count FROM letter.membership_sources;
 role_assignment_count 
-----------------------
                     1
(1 row)

-- Adding another team member
INSERT INTO team_members (user_id, project_id, role) VALUES
    ('a0000000-0000-0000-0000-000000000002', 'b0000000-0000-0000-0000-000000000001', 'viewer');
SELECT role, user_id, scope_table, scope_id FROM letter.memberships ORDER BY role, user_id;
  role  |               user_id                | scope_table |               scope_id               
--------+--------------------------------------+-------------+--------------------------------------
 editor | a0000000-0000-0000-0000-000000000001 | projects    | b0000000-0000-0000-0000-000000000001
 viewer | a0000000-0000-0000-0000-000000000002 | projects    | b0000000-0000-0000-0000-000000000001
(2 rows)

-- Updating the role column should update the role
UPDATE team_members SET role = 'admin'
    WHERE user_id = 'a0000000-0000-0000-0000-000000000001'
    AND project_id = 'b0000000-0000-0000-0000-000000000001';
SELECT role, user_id, scope_table, scope_id FROM letter.memberships ORDER BY role, user_id;
  role  |               user_id                | scope_table |               scope_id               
--------+--------------------------------------+-------------+--------------------------------------
 admin  | a0000000-0000-0000-0000-000000000001 | projects    | b0000000-0000-0000-0000-000000000001
 viewer | a0000000-0000-0000-0000-000000000002 | projects    | b0000000-0000-0000-0000-000000000001
(2 rows)

-- ============================================================
-- Test 2: Cleanup - deleting source row removes the role
-- ============================================================
DELETE FROM team_members
    WHERE user_id = 'a0000000-0000-0000-0000-000000000002'
    AND project_id = 'b0000000-0000-0000-0000-000000000001';
SELECT role, user_id FROM letter.memberships ORDER BY role;
 role  |               user_id                
-------+--------------------------------------
 admin | a0000000-0000-0000-0000-000000000001
(1 row)

SELECT count(*) AS remaining FROM letter.membership_sources;
 remaining 
-----------
         1
(1 row)

-- ============================================================
-- Test 3: Cleanup - deleting scope row removes scoped roles
-- ============================================================
-- Give Alice a role on Beta too
INSERT INTO team_members (user_id, project_id, role) VALUES
    ('a0000000-0000-0000-0000-000000000001', 'b0000000-0000-0000-0000-000000000002', 'viewer');
SELECT count(*) AS roles_before FROM letter.memberships;
 roles_before 
--------------
            2
(1 row)

-- Delete Project Alpha - should remove Alice's admin role on Alpha but keep her viewer on Beta
DELETE FROM projects WHERE id = 'b0000000-0000-0000-0000-000000000001';
SELECT role, user_id, scope_id FROM letter.memberships ORDER BY role;
  role  |               user_id                |               scope_id               
--------+--------------------------------------+--------------------------------------
 viewer | a0000000-0000-0000-0000-000000000001 | b0000000-0000-0000-0000-000000000002
(1 row)

-- ============================================================
-- Test 4: Cleanup - deleting user cascades through and removes roles
-- ============================================================
DELETE FROM users WHERE id = 'a0000000-0000-0000-0000-000000000001';
SELECT count(*) AS roles_after_user_delete FROM letter.memberships;
 roles_after_user_delete 
-------------------------
                       0
(1 row)

SELECT count(*) AS assignments_after FROM letter.membership_sources;
 assignments_after 
-------------------
                 0
(1 row)

-- ============================================================
-- Test 5: Unscoped assignment with a fixed role name
-- ============================================================
CREATE TABLE admins (
    id uuid PRIMARY KEY DEFAULT gen_random_uuid(),
    user_id uuid NOT NULL REFERENCES users(id) ON DELETE CASCADE
);
SET letter.bypass = on;
SELECT letter.assign('public.admins', 'user_id', role := 'superadmin');
 assign 
--------
 t
(1 row)

RESET letter.bypass;
INSERT INTO users (id, name) VALUES ('a0000000-0000-0000-0000-000000000003', 'Charlie');
INSERT INTO admins (user_id) VALUES ('a0000000-0000-0000-0000-000000000003');
SELECT role, user_id, scope_table, scope_id FROM letter.memberships;
    role    |               user_id                | scope_table | scope_id 
------------+--------------------------------------+-------------+----------
 superadmin | a0000000-0000-0000-0000-000000000003 |             | 
(1 row)

-- Removing from admins removes the role
DELETE FROM admins WHERE user_id = 'a0000000-0000-0000-0000-000000000003';
SELECT count(*) AS roles_after_admin_delete FROM letter.memberships;
 roles_after_admin_delete 
--------------------------
                        0
(1 row)

-- ============================================================
-- Test 6: assign with an if (plan/20 §3): the source row must satisfy
-- it to confer the membership — on backfill, on insert, and as it
-- changes. Validated like a grant's if.
-- ============================================================
CREATE TABLE staff (
    id uuid PRIMARY KEY DEFAULT gen_random_uuid(),
    user_id uuid NOT NULL REFERENCES users(id) ON DELETE CASCADE,
    active boolean NOT NULL DEFAULT true,
    title TEXT
);
INSERT INTO users (id, name) VALUES
    ('a0000000-0000-0000-0000-000000000004', 'Dora'),
    ('a0000000-0000-0000-0000-000000000005', 'Eve');
INSERT INTO staff (user_id, active, title) VALUES
    ('a0000000-0000-0000-0000-000000000004', true,  'on duty'),
    ('a0000000-0000-0000-0000-000000000005', false, 'on leave');
SET letter.bypass = on;
SELECT letter.assign('public.staff', 'user_id', role := 'staff', if := 'active AND title <> ''fired''');
 assign 
--------
 t
(1 row)

\set VERBOSITY terse
SELECT letter.assign('public.staff', 'user_id', role := 'bad', if := 'title');
ERROR:  letter: invalid if expression for assign on public.staff: the expression is text, not boolean
SELECT letter.assign('public.staff', 'user_id', role := 'bad', if := 'EXISTS (SELECT 1)');
ERROR:  letter: invalid if expression for assign on public.staff: subqueries are not allowed: an if expression sees only the row
\set VERBOSITY default
RESET letter.bypass;
SELECT role, user_id FROM letter.memberships WHERE role = 'staff' ORDER BY user_id;
 role  |               user_id                
-------+--------------------------------------
 staff | a0000000-0000-0000-0000-000000000004
(1 row)

UPDATE staff SET active = true WHERE title = 'on leave';                 -- Eve joins
UPDATE staff SET title = 'fired' WHERE user_id = 'a0000000-0000-0000-0000-000000000004';   -- Dora leaves
SELECT role, user_id FROM letter.memberships WHERE role = 'staff' ORDER BY user_id;
 role  |               user_id                
-------+--------------------------------------
 staff | a0000000-0000-0000-0000-000000000005
(1 row)

INSERT INTO users (id, name) VALUES ('a0000000-0000-0000-0000-000000000006', 'Fay');
INSERT INTO staff (user_id, active) VALUES ('a0000000-0000-0000-0000-000000000006', false);   -- no membership
SELECT count(*) AS staff_memberships FROM letter.memberships WHERE role = 'staff';
 staff_memberships 
-------------------
                 1
(1 row)

-- Dropping a column the if names removes the rule (and its memberships).
ALTER TABLE staff DROP COLUMN title;
NOTICE:  letter: removed the membership rule on public.staff: letter: invalid if expression for assign on public.staff: column "title" does not exist
SELECT count(*) AS rules FROM letter.membership_rules WHERE table_name = 'public.staff'::regclass;
 rules 
-------
     0
(1 row)

SELECT count(*) AS staff_memberships FROM letter.memberships WHERE role = 'staff';
 staff_memberships 
-------------------
                 0
(1 row)

DROP TABLE staff CASCADE;
-- ============================================================
-- Test 7: a table that is its own scope (plan/21 D8): a project's owner
-- is scoped to that project — the rule that lets a user bootstrap a
-- scope by authoring the resource. The scope id is the row's own key.
-- ============================================================
CREATE TABLE owned_projects (
    id uuid PRIMARY KEY DEFAULT gen_random_uuid(),
    owner_id uuid NOT NULL REFERENCES users(id) ON DELETE CASCADE,
    name text NOT NULL
);
INSERT INTO users (id, name) VALUES
    ('a0000000-0000-0000-0000-000000000007', 'Gus'),
    ('a0000000-0000-0000-0000-000000000008', 'Hal');
INSERT INTO owned_projects (id, owner_id, name) VALUES
    ('d0000000-0000-0000-0000-000000000001', 'a0000000-0000-0000-0000-000000000007', 'Gus''s');
SET letter.bypass = on;
SELECT letter.assign('public.owned_projects', 'owner_id', role := 'owner', scope := 'public.owned_projects');
 assign 
--------
 t
(1 row)

RESET letter.bypass;
-- backfill: the existing project's owner
SELECT role, user_id, scope_table, scope_id FROM letter.memberships WHERE role = 'owner';
 role  |               user_id                |  scope_table   |               scope_id               
-------+--------------------------------------+----------------+--------------------------------------
 owner | a0000000-0000-0000-0000-000000000007 | owned_projects | d0000000-0000-0000-0000-000000000001
(1 row)

-- a new project makes its author its owner
INSERT INTO owned_projects (id, owner_id, name) VALUES
    ('d0000000-0000-0000-0000-000000000002', 'a0000000-0000-0000-0000-000000000008', 'Hal''s');
SELECT role, user_id, scope_id FROM letter.memberships WHERE role = 'owner' ORDER BY scope_id;
 role  |               user_id                |               scope_id               
-------+--------------------------------------+--------------------------------------
 owner | a0000000-0000-0000-0000-000000000007 | d0000000-0000-0000-0000-000000000001
 owner | a0000000-0000-0000-0000-000000000008 | d0000000-0000-0000-0000-000000000002
(2 rows)

-- handing a project over moves the membership
UPDATE owned_projects SET owner_id = 'a0000000-0000-0000-0000-000000000008' WHERE name = 'Gus''s';
SELECT role, user_id, scope_id FROM letter.memberships WHERE role = 'owner' ORDER BY scope_id;
 role  |               user_id                |               scope_id               
-------+--------------------------------------+--------------------------------------
 owner | a0000000-0000-0000-0000-000000000008 | d0000000-0000-0000-0000-000000000001
 owner | a0000000-0000-0000-0000-000000000008 | d0000000-0000-0000-0000-000000000002
(2 rows)

-- deleting a project removes its membership (no scope-delete trigger is needed)
SELECT count(*) AS scope_delete_triggers FROM pg_trigger WHERE tgname LIKE 'letter_rule_%_scope_delete';
 scope_delete_triggers 
-----------------------
                     1
(1 row)

DELETE FROM owned_projects WHERE name = 'Hal''s';
SELECT role, user_id, scope_id FROM letter.memberships WHERE role = 'owner' ORDER BY scope_id;
 role  |               user_id                |               scope_id               
-------+--------------------------------------+--------------------------------------
 owner | a0000000-0000-0000-0000-000000000008 | d0000000-0000-0000-0000-000000000001
(1 row)

SET letter.bypass = on;
SELECT letter.unassign('public.owned_projects', 'owner_id', role := 'owner', scope := 'public.owned_projects');
 unassign 
----------
 t
(1 row)

RESET letter.bypass;
SELECT count(*) AS owner_memberships FROM letter.memberships WHERE role = 'owner';
 owner_memberships 
-------------------
                 0
(1 row)

DROP TABLE owned_projects CASCADE;
-- ============================================================
-- Test: names that need quoting are quoted wherever assign() writes
-- them into SQL (plan/24 B6): a role with a quote in it, and columns
-- and a table with spaces and capitals.
-- ============================================================
CREATE TABLE "Odd Members" ("Row Id" uuid PRIMARY KEY DEFAULT gen_random_uuid(), "User Id" uuid NOT NULL, "Their Role" text);
INSERT INTO "Odd Members" ("User Id", "Their Role") VALUES ('a0000000-0000-0000-0000-000000000007', 'o''brien');
SET letter.bypass = on;
SELECT letter.assign('public."Odd Members"', 'User Id', role_column := 'Their Role');
 assign 
--------
 t
(1 row)

SELECT letter.assign('public."Odd Members"', 'User Id', role := 'it''s');
 assign 
--------
 t
(1 row)

RESET letter.bypass;
INSERT INTO "Odd Members" ("User Id", "Their Role") VALUES ('a0000000-0000-0000-0000-000000000008', 'd''arcy');
SELECT role, right(user_id, 4) AS who FROM letter.memberships WHERE user_id LIKE 'a0000000-0000-0000-0000-00000000000%' ORDER BY 1, 2;
  role   | who  
---------+------
 d'arcy  | 0008
 it's    | 0007
 it's    | 0008
 o'brien | 0007
(4 rows)

SET letter.bypass = on;
SELECT letter.unassign('public."Odd Members"', 'User Id', role := 'it''s');
 unassign 
----------
 t
(1 row)

SELECT letter.unassign('public."Odd Members"', 'User Id', role := 'it''s');     -- gone: an error with a proper code
ERROR:  letter: no such membership rule
HINT:  unassign takes the same source table, user column, role or role column and scope that assign took.
RESET letter.bypass;
DROP TABLE "Odd Members";
NOTICE:  letter: dropped table public."Odd Members": removed 0 grant(s), 1 rule(s), 0 membership(s)
DROP TABLE admins CASCADE;
NOTICE:  letter: dropped table public.admins: removed 0 grant(s), 1 rule(s), 0 membership(s)
DROP TABLE team_members CASCADE;
NOTICE:  letter: dropped table public.team_members: removed 0 grant(s), 1 rule(s), 0 membership(s)
DROP TABLE projects CASCADE;
DROP TABLE users CASCADE;
DROP EXTENSION letter CASCADE;
