-- Test: assign() creates rules that denormalize roles
CREATE EXTENSION letter;
WARNING:  letter: library loaded on demand, not preloaded
DETAIL:  Read enforcement is a planner hook; sessions that never call a letter function will not have it.
HINT:  Add letter to shared_preload_libraries (or session_preload_libraries).
SET letter.enforce_reads = off;   -- this test is not about the read hook
-- Set up application tables
CREATE TABLE users (
    id uuid PRIMARY KEY DEFAULT gen_random_uuid(),
    name TEXT NOT NULL
);
CREATE TABLE projects (
    id uuid PRIMARY KEY DEFAULT gen_random_uuid(),
    name TEXT NOT NULL
);
CREATE TABLE team_members (
    id uuid PRIMARY KEY DEFAULT gen_random_uuid(),
    user_id uuid NOT NULL REFERENCES users(id) ON DELETE CASCADE,
    project_id uuid NOT NULL REFERENCES projects(id) ON DELETE CASCADE,
    role TEXT NOT NULL
);
-- ============================================================
-- Test 1: Scoped assignment with role from a column
-- "rows in team_members assign the role in the 'role' column, scoped to projects"
-- ============================================================
SET letter.bypass = on;
SELECT letter.assign(
    'public.team_members',  -- source table
    'user_id',              -- user column
    'public.projects',      -- scope table
    role_name := NULL,
    role_column := 'role',
    if_fn := NULL
);
 assign 
--------
 t
(1 row)

RESET letter.bypass;
-- Verify the assignment rule was created
SELECT table_name, scope_table, user_column, role_name, role_column
    FROM letter.assignments;
  table_name  | scope_table | user_column | role_name | role_column 
--------------+-------------+-------------+-----------+-------------
 team_members | projects    | user_id     |           | role
(1 row)

-- Insert test data
INSERT INTO users (id, name) VALUES
    ('a0000000-0000-0000-0000-000000000001', 'Alice'),
    ('a0000000-0000-0000-0000-000000000002', 'Bob');
INSERT INTO projects (id, name) VALUES
    ('b0000000-0000-0000-0000-000000000001', 'Project Alpha'),
    ('b0000000-0000-0000-0000-000000000002', 'Project Beta');
-- Adding a team member should create a role
INSERT INTO team_members (user_id, project_id, role) VALUES
    ('a0000000-0000-0000-0000-000000000001', 'b0000000-0000-0000-0000-000000000001', 'editor');
SELECT role, user_id, scope_table, scope_id FROM letter.roles ORDER BY role;
  role  |               user_id                | scope_table |               scope_id               
--------+--------------------------------------+-------------+--------------------------------------
 editor | a0000000-0000-0000-0000-000000000001 | projects    | b0000000-0000-0000-0000-000000000001
(1 row)

SELECT count(*) AS role_assignment_count FROM letter.role_assignments;
 role_assignment_count 
-----------------------
                     1
(1 row)

-- Adding another team member
INSERT INTO team_members (user_id, project_id, role) VALUES
    ('a0000000-0000-0000-0000-000000000002', 'b0000000-0000-0000-0000-000000000001', 'viewer');
SELECT role, user_id, scope_table, scope_id FROM letter.roles ORDER BY role, user_id;
  role  |               user_id                | scope_table |               scope_id               
--------+--------------------------------------+-------------+--------------------------------------
 editor | a0000000-0000-0000-0000-000000000001 | projects    | b0000000-0000-0000-0000-000000000001
 viewer | a0000000-0000-0000-0000-000000000002 | projects    | b0000000-0000-0000-0000-000000000001
(2 rows)

-- Updating the role column should update the role
UPDATE team_members SET role = 'admin'
    WHERE user_id = 'a0000000-0000-0000-0000-000000000001'
    AND project_id = 'b0000000-0000-0000-0000-000000000001';
SELECT role, user_id, scope_table, scope_id FROM letter.roles ORDER BY role, user_id;
  role  |               user_id                | scope_table |               scope_id               
--------+--------------------------------------+-------------+--------------------------------------
 admin  | a0000000-0000-0000-0000-000000000001 | projects    | b0000000-0000-0000-0000-000000000001
 viewer | a0000000-0000-0000-0000-000000000002 | projects    | b0000000-0000-0000-0000-000000000001
(2 rows)

-- ============================================================
-- Test 2: Cleanup - deleting source row removes the role
-- ============================================================
DELETE FROM team_members
    WHERE user_id = 'a0000000-0000-0000-0000-000000000002'
    AND project_id = 'b0000000-0000-0000-0000-000000000001';
SELECT role, user_id FROM letter.roles ORDER BY role;
 role  |               user_id                
-------+--------------------------------------
 admin | a0000000-0000-0000-0000-000000000001
(1 row)

SELECT count(*) AS remaining FROM letter.role_assignments;
 remaining 
-----------
         1
(1 row)

-- ============================================================
-- Test 3: Cleanup - deleting scope row removes scoped roles
-- ============================================================
-- Give Alice a role on Beta too
INSERT INTO team_members (user_id, project_id, role) VALUES
    ('a0000000-0000-0000-0000-000000000001', 'b0000000-0000-0000-0000-000000000002', 'viewer');
SELECT count(*) AS roles_before FROM letter.roles;
 roles_before 
--------------
            2
(1 row)

-- Delete Project Alpha - should remove Alice's admin role on Alpha but keep her viewer on Beta
DELETE FROM projects WHERE id = 'b0000000-0000-0000-0000-000000000001';
SELECT role, user_id, scope_id FROM letter.roles ORDER BY role;
  role  |               user_id                |               scope_id               
--------+--------------------------------------+--------------------------------------
 viewer | a0000000-0000-0000-0000-000000000001 | b0000000-0000-0000-0000-000000000002
(1 row)

-- ============================================================
-- Test 4: Cleanup - deleting user cascades through and removes roles
-- ============================================================
DELETE FROM users WHERE id = 'a0000000-0000-0000-0000-000000000001';
SELECT count(*) AS roles_after_user_delete FROM letter.roles;
 roles_after_user_delete 
-------------------------
                       0
(1 row)

SELECT count(*) AS assignments_after FROM letter.role_assignments;
 assignments_after 
-------------------
                 0
(1 row)

-- ============================================================
-- Test 5: Unscoped assignment with a fixed role name
-- ============================================================
CREATE TABLE admins (
    id uuid PRIMARY KEY DEFAULT gen_random_uuid(),
    user_id uuid NOT NULL REFERENCES users(id) ON DELETE CASCADE
);
SET letter.bypass = on;
SELECT letter.assign(
    'public.admins',
    'user_id',
    NULL,                   -- no scope
    role_name := 'superadmin',
    role_column := NULL,
    if_fn := NULL
);
 assign 
--------
 t
(1 row)

RESET letter.bypass;
INSERT INTO users (id, name) VALUES ('a0000000-0000-0000-0000-000000000003', 'Charlie');
INSERT INTO admins (user_id) VALUES ('a0000000-0000-0000-0000-000000000003');
SELECT role, user_id, scope_table, scope_id FROM letter.roles;
    role    |               user_id                | scope_table | scope_id 
------------+--------------------------------------+-------------+----------
 superadmin | a0000000-0000-0000-0000-000000000003 |             | 
(1 row)

-- Removing from admins removes the role
DELETE FROM admins WHERE user_id = 'a0000000-0000-0000-0000-000000000003';
SELECT count(*) AS roles_after_admin_delete FROM letter.roles;
 roles_after_admin_delete 
--------------------------
                        0
(1 row)

DROP TABLE admins CASCADE;
NOTICE:  letter: dropped table public.admins: removed 0 grant(s), 1 assignment(s), 0 role(s)
DROP TABLE team_members CASCADE;
NOTICE:  letter: dropped table public.team_members: removed 0 grant(s), 1 assignment(s), 0 role(s)
DROP TABLE projects CASCADE;
DROP TABLE users CASCADE;
DROP EXTENSION letter CASCADE;
