-- Test: write enforcement triggers
CREATE EXTENSION letter;
WARNING:  letter: library loaded on demand, not preloaded
DETAIL:  Read enforcement is a planner hook; sessions that never call a letter function will not have it.
HINT:  Add letter to shared_preload_libraries (or session_preload_libraries).
SET letter.enforce_reads = off;   -- this test is not about the read hook
-- Set up application tables
CREATE TABLE users (
    id uuid PRIMARY KEY DEFAULT gen_random_uuid(),
    name TEXT NOT NULL
);
CREATE TABLE projects (
    id uuid PRIMARY KEY DEFAULT gen_random_uuid(),
    name TEXT NOT NULL,
    status TEXT DEFAULT 'active',
    budget INTEGER
);
CREATE TABLE team_members (
    id uuid PRIMARY KEY DEFAULT gen_random_uuid(),
    user_id uuid NOT NULL REFERENCES users(id) ON DELETE CASCADE,
    project_id uuid NOT NULL REFERENCES projects(id) ON DELETE CASCADE,
    role TEXT NOT NULL
);
-- Create users
INSERT INTO users (id, name) VALUES
    ('a0000000-0000-0000-0000-000000000001', 'Alice'),
    ('a0000000-0000-0000-0000-000000000002', 'Bob');
-- Create projects
INSERT INTO projects (id, name) VALUES
    ('b0000000-0000-0000-0000-000000000001', 'Project Alpha'),
    ('b0000000-0000-0000-0000-000000000002', 'Project Beta');
-- Set up assignments so users get roles
SET letter.bypass = on;
SELECT letter.assign('public.team_members', 'user_id', role_column := 'role', scope := 'public.projects');
 assign 
--------
 t
(1 row)

RESET letter.bypass;
INSERT INTO team_members (user_id, project_id, role) VALUES
    ('a0000000-0000-0000-0000-000000000001', 'b0000000-0000-0000-0000-000000000001', 'editor'),
    ('a0000000-0000-0000-0000-000000000002', 'b0000000-0000-0000-0000-000000000001', 'viewer');
-- Set up grants on projects table
-- editor can update name and status, scoped to projects
SELECT letter.grant_scoped('update', 'public.projects', 'editor', ARRAY['name', 'status'], 'public.projects');
WARNING:  letter: "editor" has no select grant on public.projects — it can see no row, so it can change none
HINT:  A write reaches only the rows the writer can see: grant select on the columns the role must see first.
 grant_scoped 
--------------
 t
(1 row)

-- editor can set budget (only when NULL), scoped to projects
SELECT letter.grant_scoped('fill', 'public.projects', 'editor', ARRAY['budget'], 'public.projects');
WARNING:  letter: "editor" has no select grant on public.projects — it can see no row, so it can change none
HINT:  A write reaches only the rows the writer can see: grant select on the columns the role must see first.
 grant_scoped 
--------------
 t
(1 row)

-- editor can insert projects (unscoped)
SELECT letter.grant_global('insert', 'public.projects', 'editor');
 grant_global 
--------------
 t
(1 row)

-- editor can delete projects (unscoped — applies to any project)
SELECT letter.grant_global('delete', 'public.projects', 'editor');
WARNING:  letter: "editor" has no select grant on public.projects — it can see no row, so it can change none
HINT:  A write reaches only the rows the writer can see: grant select on the columns the role must see first.
 grant_global 
--------------
 t
(1 row)

-- viewer can only select (no write grants)
-- Verify GUC works
SET letter.user_id = 'alice_test';
SELECT current_setting('letter.user_id');
 current_setting 
-----------------
 alice_test
(1 row)

RESET letter.user_id;
-- ============================================================
-- Test 1: Fail closed - no user ID set
-- ============================================================
\set VERBOSITY terse
UPDATE projects SET name = 'New Name' WHERE id = 'b0000000-0000-0000-0000-000000000001';
ERROR:  letter: UPDATE denied on "public.projects" — letter.user_id is not set
-- ============================================================
-- Test 2: UPDATE allowed with update grant
-- ============================================================
SET letter.user_id = 'a0000000-0000-0000-0000-000000000001';
UPDATE projects SET name = 'Alpha Updated' WHERE id = 'b0000000-0000-0000-0000-000000000001';
SELECT name FROM projects WHERE id = 'b0000000-0000-0000-0000-000000000001';
     name      
---------------
 Alpha Updated
(1 row)

-- ============================================================
-- Test 3: UPDATE denied - viewer has no update grant
-- ============================================================
SET letter.user_id = 'a0000000-0000-0000-0000-000000000002';
UPDATE projects SET name = 'Viewer Attempt' WHERE id = 'b0000000-0000-0000-0000-000000000001';
ERROR:  letter: UPDATE denied on "public.projects" column "name" for user "a0000000-0000-0000-0000-000000000002" — requires 'update' privilege
-- ============================================================
-- Test 4: SET allowed - budget is NULL, editor has set grant
-- ============================================================
SET letter.user_id = 'a0000000-0000-0000-0000-000000000001';
UPDATE projects SET budget = 50000 WHERE id = 'b0000000-0000-0000-0000-000000000001';
SELECT budget FROM projects WHERE id = 'b0000000-0000-0000-0000-000000000001';
 budget 
--------
  50000
(1 row)

-- ============================================================
-- Test 5: SET denied - budget is no longer NULL, set grant insufficient
-- ============================================================
UPDATE projects SET budget = 99999 WHERE id = 'b0000000-0000-0000-0000-000000000001';
ERROR:  letter: UPDATE denied on "public.projects" column "budget" for user "a0000000-0000-0000-0000-000000000001" — requires 'update' privilege
-- ============================================================
-- Test 6: Scoped - editor can't update project they're not scoped to
-- ============================================================
UPDATE projects SET name = 'Beta Hacked' WHERE id = 'b0000000-0000-0000-0000-000000000002';
ERROR:  letter: UPDATE denied on "public.projects" column "name" for user "a0000000-0000-0000-0000-000000000001" — requires 'update' privilege
-- Verify Beta was not modified
SELECT name FROM projects WHERE id = 'b0000000-0000-0000-0000-000000000002';
     name     
--------------
 Project Beta
(1 row)

-- ============================================================
-- Test 7: INSERT allowed with insert grant (row-level check)
-- ============================================================
-- The insert grant is unscoped, and Alice holds 'editor' only in
-- project Alpha's scope. An unscoped grant needs the role in the global
-- scope (plan/17 D11): denied.
INSERT INTO projects (id, name) VALUES ('b0000000-0000-0000-0000-000000000003', 'Project Gamma');
ERROR:  letter: INSERT denied on "public.projects" for user "a0000000-0000-0000-0000-000000000001"
-- Give Alice the global 'editor' role: allowed.
INSERT INTO letter.memberships (role, user_id)
    VALUES ('editor', 'a0000000-0000-0000-0000-000000000001');
INSERT INTO projects (id, name) VALUES ('b0000000-0000-0000-0000-000000000003', 'Project Gamma');
SELECT name FROM projects WHERE id = 'b0000000-0000-0000-0000-000000000003';
     name      
---------------
 Project Gamma
(1 row)

-- ============================================================
-- Test 8: INSERT denied - viewer has no insert grant
-- ============================================================
SET letter.user_id = 'a0000000-0000-0000-0000-000000000002';
INSERT INTO projects (id, name) VALUES ('b0000000-0000-0000-0000-000000000004', 'Viewer Project');
ERROR:  letter: INSERT denied on "public.projects" for user "a0000000-0000-0000-0000-000000000002"
-- ============================================================
-- Test 9: DELETE allowed with delete grant
-- ============================================================
SET letter.user_id = 'a0000000-0000-0000-0000-000000000001';
DELETE FROM projects WHERE id = 'b0000000-0000-0000-0000-000000000003';
SELECT count(*) AS remaining FROM projects WHERE id = 'b0000000-0000-0000-0000-000000000003';
 remaining 
-----------
         0
(1 row)

-- ============================================================
-- Test 10: DELETE denied - viewer has no delete grant
-- ============================================================
SET letter.user_id = 'a0000000-0000-0000-0000-000000000002';
DELETE FROM projects WHERE id = 'b0000000-0000-0000-0000-000000000001';
ERROR:  letter: DELETE denied on "public.projects" for user "a0000000-0000-0000-0000-000000000002"
-- ============================================================
-- Test 11: Triggers auto-installed on first grant, auto-removed on last revoke
-- ============================================================
\set VERBOSITY default
SELECT count(*) AS trigger_count FROM pg_trigger
    WHERE tgname LIKE 'letter_enforce_%'
    AND tgrelid = 'projects'::regclass;
 trigger_count 
---------------
             4
(1 row)

SELECT letter.revoke_scoped('update', 'public.projects', 'editor', ARRAY['*'], 'public.projects');
 revoke_scoped 
---------------
 t
(1 row)

SELECT letter.revoke_scoped('fill', 'public.projects', 'editor', ARRAY['*'], 'public.projects');
 revoke_scoped 
---------------
 t
(1 row)

SELECT letter.revoke_global('insert', 'public.projects', 'editor');
 revoke_global 
---------------
 t
(1 row)

SELECT letter.revoke_global('delete', 'public.projects', 'editor');
 revoke_global 
---------------
 t
(1 row)

SELECT count(*) AS trigger_count_after FROM pg_trigger
    WHERE tgname LIKE 'letter_enforce_%'
    AND tgrelid = 'projects'::regclass;
 trigger_count_after 
---------------------
                   0
(1 row)

-- ============================================================
-- Test 12: `if` on write grants (plan/20 §3). Alice is editor@Alpha
-- and a global editor; the projects' write triggers are re-installed
-- by the first grant below.
-- ============================================================
CREATE TABLE notes (
    id uuid PRIMARY KEY DEFAULT gen_random_uuid(),
    project_id uuid NOT NULL REFERENCES projects(id),
    author uuid,
    body TEXT,
    reviewed_by uuid
);
CREATE INDEX ON notes (project_id);
-- Single-row form on update: evaluated on OLD and on NEW, both must pass.
-- Editors may change the status of a project that is not archived — and
-- may not archive one, since the NEW row would fail.
SELECT letter.grant_scoped('update', 'public.projects', 'editor', ARRAY['status'], 'public.projects',
                           if := 'status <> ''archived''');
WARNING:  letter: "editor" has no select grant on public.projects — it can see no row, so it can change none
HINT:  A write reaches only the rows the writer can see: grant select on the columns the role must see first.
 grant_scoped 
--------------
 t
(1 row)

SET letter.user_id = 'a0000000-0000-0000-0000-000000000001';
UPDATE projects SET status = 'paused' WHERE id = 'b0000000-0000-0000-0000-000000000001';
UPDATE projects SET status = 'archived' WHERE id = 'b0000000-0000-0000-0000-000000000001';
ERROR:  letter: UPDATE denied on "public.projects" column "status" for user "a0000000-0000-0000-0000-000000000001" — requires 'update' privilege
SET letter.bypass = on;
UPDATE projects SET status = 'archived' WHERE id = 'b0000000-0000-0000-0000-000000000001';
RESET letter.bypass;
UPDATE projects SET status = 'active' WHERE id = 'b0000000-0000-0000-0000-000000000001';   -- OLD fails
ERROR:  letter: UPDATE denied on "public.projects" column "status" for user "a0000000-0000-0000-0000-000000000001" — requires 'update' privilege
SELECT status FROM projects WHERE id = 'b0000000-0000-0000-0000-000000000001';
  status  
----------
 archived
(1 row)

-- Transition form: names old and new, evaluated once. Editors may archive
-- an active project, and nothing else under this rule.
SELECT letter.grant_scoped('update', 'public.projects', 'editor', ARRAY['status'], 'public.projects',
                           if := 'old.status = ''active'' AND new.status = ''archived''');
WARNING:  letter: "editor" has no select grant on public.projects — it can see no row, so it can change none
HINT:  A write reaches only the rows the writer can see: grant select on the columns the role must see first.
 grant_scoped 
--------------
 t
(1 row)

SET letter.bypass = on;
UPDATE projects SET status = 'active' WHERE id = 'b0000000-0000-0000-0000-000000000001';
RESET letter.bypass;
UPDATE projects SET status = 'archived' WHERE id = 'b0000000-0000-0000-0000-000000000001';   -- transition rule
UPDATE projects SET status = 'active' WHERE id = 'b0000000-0000-0000-0000-000000000001';     -- neither rule
ERROR:  letter: UPDATE denied on "public.projects" column "status" for user "a0000000-0000-0000-0000-000000000001" — requires 'update' privilege
SELECT status FROM projects WHERE id = 'b0000000-0000-0000-0000-000000000001';
  status  
----------
 archived
(1 row)

-- Authorship: insert and delete only your own notes; fill reviewed_by only
-- on notes that are not yours.
SELECT letter.grant_scoped('insert', 'public.notes', 'editor', NULL, 'public.projects',
                           if := 'author = letter.user_id()::uuid');
 grant_scoped 
--------------
 t
(1 row)

SELECT letter.grant_scoped('delete', 'public.notes', 'editor', NULL, 'public.projects',
                           if := 'author = letter.user_id()::uuid');
WARNING:  letter: "editor" has no select grant on public.notes — it can see no row, so it can change none
HINT:  A write reaches only the rows the writer can see: grant select on the columns the role must see first.
 grant_scoped 
--------------
 t
(1 row)

SELECT letter.grant_scoped('fill', 'public.notes', 'editor', ARRAY['reviewed_by'], 'public.projects',
                           if := 'author <> letter.user_id()::uuid');
WARNING:  letter: "editor" has no select grant on public.notes — it can see no row, so it can change none
HINT:  A write reaches only the rows the writer can see: grant select on the columns the role must see first.
 grant_scoped 
--------------
 t
(1 row)

INSERT INTO notes (id, project_id, author, body) VALUES
    ('c0000000-0000-0000-0000-000000000001', 'b0000000-0000-0000-0000-000000000001',
     'a0000000-0000-0000-0000-000000000001', 'mine');
INSERT INTO notes (id, project_id, author, body) VALUES
    ('c0000000-0000-0000-0000-000000000002', 'b0000000-0000-0000-0000-000000000001',
     'a0000000-0000-0000-0000-000000000002', 'as bob');
ERROR:  letter: INSERT denied on "public.notes" for user "a0000000-0000-0000-0000-000000000001"
SET letter.bypass = on;
INSERT INTO notes (id, project_id, author, body) VALUES
    ('c0000000-0000-0000-0000-000000000002', 'b0000000-0000-0000-0000-000000000001',
     'a0000000-0000-0000-0000-000000000002', 'bobs');
RESET letter.bypass;
UPDATE notes SET reviewed_by = 'a0000000-0000-0000-0000-000000000001' WHERE body = 'mine';   -- own: refused
ERROR:  letter: UPDATE denied on "public.notes" column "reviewed_by" for user "a0000000-0000-0000-0000-000000000001" — requires 'fill' or 'update' privilege
UPDATE notes SET reviewed_by = 'a0000000-0000-0000-0000-000000000001' WHERE body = 'bobs';   -- not own: allowed
DELETE FROM notes WHERE body = 'bobs';
ERROR:  letter: DELETE denied on "public.notes" for user "a0000000-0000-0000-0000-000000000001"
DELETE FROM notes WHERE body = 'mine';
SELECT body, reviewed_by FROM notes ORDER BY body;
 body |             reviewed_by              
------+--------------------------------------
 bobs | a0000000-0000-0000-0000-000000000001
(1 row)

-- A NULL if is a failed if: a note without an author cannot be inserted.
INSERT INTO notes (project_id, author, body) VALUES ('b0000000-0000-0000-0000-000000000001', NULL, 'anon');
ERROR:  letter: INSERT denied on "public.notes" for user "a0000000-0000-0000-0000-000000000001"
-- The transition form is refused on a rule with one row.
SELECT letter.grant_scoped('insert', 'public.notes', 'editor', NULL, 'public.projects',
                           if := 'old.body = new.body');
ERROR:  letter: invalid if expression for insert on public.notes: missing FROM-clause entry for table "old"
CONTEXT:  PL/pgSQL function letter.grant_scoped(text,regclass,text,text[],regclass,text[],text) line 7 at RETURN
-- And on update, an unqualified name is ambiguous in the transition form:
-- the row form is tried first, so a plain expression is the row form.
SELECT letter.grant_scoped('update', 'public.notes', 'editor', ARRAY['body'], 'public.projects',
                           if := 'body <> new.body');
ERROR:  letter: invalid if expression for update on public.notes: missing FROM-clause entry for table "new" (as a transition over old and new: column reference "body" is ambiguous)
CONTEXT:  PL/pgSQL function letter.grant_scoped(text,regclass,text,text[],regclass,text[],text) line 7 at RETURN
RESET letter.user_id;
DROP TABLE notes;
NOTICE:  letter: dropped table public.notes: removed 3 grant(s), 0 assignment(s), 0 role(s)
-- ============================================================
-- Test 13: the built-in roles on the write path (plan/22). Sign-up: any
-- session with a user may insert its own users row and no other. A
-- guestbook: anyone may insert, no user set at all. With no user set, a
-- table whose write rules all need a user still errors as before.
-- ============================================================
SELECT letter.grant_global('insert', 'public.users', 'any_user', if := 'id = letter.user_id()::uuid');
 grant_global 
--------------
 t
(1 row)

SET letter.user_id = 'a0000000-0000-0000-0000-000000000009';
INSERT INTO users (id, name) VALUES ('a0000000-0000-0000-0000-000000000009', 'Ida');     -- herself
INSERT INTO users (id, name) VALUES ('a0000000-0000-0000-0000-000000000010', 'Jon');     -- somebody else
ERROR:  letter: INSERT denied on "public.users" for user "a0000000-0000-0000-0000-000000000009"
RESET letter.user_id;
INSERT INTO users (id, name) VALUES ('a0000000-0000-0000-0000-000000000010', 'Jon');     -- nobody at all
ERROR:  letter: INSERT denied on "public.users" — letter.user_id is not set
SELECT name FROM users ORDER BY name;
 name  
-------
 Alice
 Bob
 Ida
(3 rows)

CREATE TABLE guestbook (id serial PRIMARY KEY, line text, approved boolean NOT NULL DEFAULT false);
SELECT letter.grant_global('insert', 'public.guestbook', 'anyone', if := 'NOT approved');
 grant_global 
--------------
 t
(1 row)

SELECT letter.grant_global('update', 'public.guestbook', 'any_user', ARRAY['line']);
WARNING:  letter: "any_user" has no select grant on public.guestbook — it can see no row, so it can change none
HINT:  A write reaches only the rows the writer can see: grant select on the columns the role must see first.
 grant_global 
--------------
 t
(1 row)

INSERT INTO guestbook (line) VALUES ('hello from nobody');                 -- no user set: anyone
INSERT INTO guestbook (line, approved) VALUES ('sneaky', true);            -- the if
ERROR:  letter: INSERT denied on "public.guestbook" — letter.user_id is not set
UPDATE guestbook SET line = 'edited';                                      -- no user: no anyone rule for update
ERROR:  letter: UPDATE denied on "public.guestbook" — letter.user_id is not set
SET letter.user_id = 'a0000000-0000-0000-0000-000000000009';
UPDATE guestbook SET line = 'edited by ida';                               -- but any user may
SELECT line, approved FROM guestbook;
     line      | approved 
---------------+----------
 edited by ida | f
(1 row)

RESET letter.user_id;
SELECT letter.revoke_global('insert', 'public.users', 'any_user');
 revoke_global 
---------------
 t
(1 row)

DROP TABLE guestbook;
NOTICE:  letter: dropped table public.guestbook: removed 2 grant(s), 0 assignment(s), 0 role(s)
-- Clean up
DROP TABLE team_members CASCADE;
NOTICE:  letter: dropped table public.team_members: removed 0 grant(s), 1 assignment(s), 0 role(s)
DROP TABLE projects CASCADE;
NOTICE:  letter: dropped table public.projects: removed 2 grant(s), 0 assignment(s), 0 role(s)
DROP TABLE users CASCADE;
DROP EXTENSION letter CASCADE;
