-- Test: write-path redaction of the result relation
-- (plan/19-write-path-redaction.md W2, decisions D1–D5)
--
-- The table a statement writes to stays a real relation, so it gets a
-- security qual (rows the user cannot see are not there — skipped, not
-- refused) and its hidden columns read as NULL in the qual, SET, RETURNING
-- and ON CONFLICT. Triggers still decide writability of the rows that are
-- there.
--
-- Users:  alice  editor@Alpha (sees everything of Alpha), viewer@Beta (name only)
--         bob    viewer@Alpha
-- Grants: projects  select editor * / viewer name; update editor name,status; delete editor
--         notes     select editor body (extra hidden even from editors);
--                   update/insert/delete editor
CREATE EXTENSION letter;
WARNING:  letter: library loaded on demand, not preloaded
DETAIL:  Read enforcement is a planner hook; sessions that never call a letter function will not have it.
HINT:  Add letter to shared_preload_libraries (or session_preload_libraries).
SET letter.bypass = on;
CREATE TABLE users (id uuid PRIMARY KEY, name TEXT);
CREATE TABLE projects (
    id uuid PRIMARY KEY,
    name TEXT NOT NULL,
    status TEXT DEFAULT 'active',
    secret TEXT
);
CREATE TABLE notes (
    id uuid PRIMARY KEY DEFAULT gen_random_uuid(),
    project_id uuid NOT NULL REFERENCES projects(id),
    body TEXT,
    extra TEXT
);
CREATE INDEX ON notes (project_id);
CREATE UNIQUE INDEX notes_project_body ON notes (project_id, body);   -- for the upsert of case 5
CREATE TABLE team_members (
    id uuid PRIMARY KEY DEFAULT gen_random_uuid(),
    user_id uuid NOT NULL REFERENCES users(id),
    project_id uuid NOT NULL REFERENCES projects(id),
    role TEXT NOT NULL
);
INSERT INTO users VALUES
    ('a0000000-0000-0000-0000-000000000001', 'Alice'),
    ('a0000000-0000-0000-0000-000000000002', 'Bob');
INSERT INTO projects VALUES
    ('b0000000-0000-0000-0000-000000000001', 'Alpha', 'active', 's1'),
    ('b0000000-0000-0000-0000-000000000002', 'Beta',  'draft',  's2'),
    ('b0000000-0000-0000-0000-000000000003', 'Gamma', 'done',   's3');
INSERT INTO notes (id, project_id, body, extra) VALUES
    ('c0000000-0000-0000-0000-000000000001', 'b0000000-0000-0000-0000-000000000001', 'n1', 'x1'),
    ('c0000000-0000-0000-0000-000000000002', 'b0000000-0000-0000-0000-000000000002', 'n2', 'x2'),
    ('c0000000-0000-0000-0000-000000000003', 'b0000000-0000-0000-0000-000000000003', 'n3', 'x3');
SELECT letter.assign('public.team_members', 'user_id', role_column := 'role', scope := 'public.projects');
 assign 
--------
 t
(1 row)

INSERT INTO team_members (user_id, project_id, role) VALUES
    ('a0000000-0000-0000-0000-000000000001', 'b0000000-0000-0000-0000-000000000001', 'editor'),
    ('a0000000-0000-0000-0000-000000000001', 'b0000000-0000-0000-0000-000000000002', 'viewer'),
    ('a0000000-0000-0000-0000-000000000002', 'b0000000-0000-0000-0000-000000000001', 'viewer');
SELECT letter.grant_scoped('select', 'public.projects', 'editor', ARRAY['*'], 'public.projects');
 grant_scoped 
--------------
 t
(1 row)

SELECT letter.grant_scoped('select', 'public.projects', 'viewer', ARRAY['name'], 'public.projects');
 grant_scoped 
--------------
 t
(1 row)

SELECT letter.grant_scoped('update', 'public.projects', 'editor', ARRAY['name', 'status'], 'public.projects');
 grant_scoped 
--------------
 t
(1 row)

SELECT letter.grant_scoped('delete', 'public.projects', 'editor', ARRAY['*'], 'public.projects');
 grant_scoped 
--------------
 t
(1 row)

SELECT letter.grant_scoped('select', 'public.notes', 'editor', ARRAY['body'], 'public.projects');
 grant_scoped 
--------------
 t
(1 row)

SELECT letter.grant_scoped('update', 'public.notes', 'editor', ARRAY['body', 'extra'], 'public.projects');
 grant_scoped 
--------------
 t
(1 row)

SELECT letter.grant_scoped('insert', 'public.notes', 'editor', ARRAY['*'], 'public.projects');
 grant_scoped 
--------------
 t
(1 row)

SELECT letter.grant_scoped('delete', 'public.notes', 'editor', ARRAY['*'], 'public.projects');
 grant_scoped 
--------------
 t
(1 row)

CREATE FUNCTION truth() RETURNS TABLE (tbl text, id uuid, a text, b text) LANGUAGE plpgsql AS $$
BEGIN
    RETURN QUERY SELECT 'projects', p.id, p.name, p.status FROM projects p ORDER BY p.name;
    RETURN QUERY SELECT 'notes', n.id, n.body, n.extra FROM notes n ORDER BY n.body;
END $$ SET letter.bypass = on;
SET letter.bypass = off;
SET letter.enforce_reads = on;
SET letter.user_id = 'a0000000-0000-0000-0000-000000000001';
\set VERBOSITY terse
-- ============================================================
-- 1. The qual cannot see hidden columns: Beta's secret is hidden
--    from alice (viewer there), Gamma is invisible. No error, no
--    row count that says otherwise.
-- ============================================================
SET client_min_messages = debug1;
WITH u AS (UPDATE projects SET name = name WHERE secret = 's2' RETURNING 1) SELECT count(*) AS beta_by_secret FROM u;
DEBUG:  letter: planner hook: redacting result relation "public.projects"
 beta_by_secret 
----------------
              0
(1 row)

RESET client_min_messages;
WITH u AS (UPDATE projects SET name = name WHERE secret = 's3' RETURNING 1) SELECT count(*) AS gamma_by_secret FROM u;
 gamma_by_secret 
-----------------
               0
(1 row)

WITH u AS (UPDATE projects SET name = name WHERE secret = 's1' RETURNING 1) SELECT count(*) AS alpha_by_secret FROM u;
 alpha_by_secret 
-----------------
               1
(1 row)

WITH d AS (DELETE FROM projects WHERE secret = 's2' RETURNING 1) SELECT count(*) AS beta_deleted FROM d;
 beta_deleted 
--------------
            0
(1 row)

SELECT * FROM truth() WHERE tbl = 'projects';
   tbl    |                  id                  |   a   |   b    
----------+--------------------------------------+-------+--------
 projects | b0000000-0000-0000-0000-000000000001 | Alpha | active
 projects | b0000000-0000-0000-0000-000000000002 | Beta  | draft
 projects | b0000000-0000-0000-0000-000000000003 | Gamma | done
(3 rows)

-- ============================================================
-- 2. Invisible rows are skipped (D1); visible but unwritable rows
--    still error from the trigger.
-- ============================================================
WITH u AS (UPDATE projects SET name = 'x' WHERE id = 'b0000000-0000-0000-0000-000000000003' RETURNING 1) SELECT count(*) AS gamma_updated FROM u;
 gamma_updated 
---------------
             0
(1 row)

WITH d AS (DELETE FROM projects WHERE id = 'b0000000-0000-0000-0000-000000000003' RETURNING 1) SELECT count(*) AS gamma_deleted FROM d;
 gamma_deleted 
---------------
             0
(1 row)

UPDATE projects SET name = 'x' WHERE id = 'b0000000-0000-0000-0000-000000000002';
ERROR:  letter: UPDATE denied on "public.projects" column "name" for user "a0000000-0000-0000-0000-000000000001" — requires 'update' privilege
-- parity: an unqualified UPDATE touches exactly the rows SELECT shows
SELECT count(*) AS visible FROM notes;
 visible 
---------
       1
(1 row)

WITH u AS (UPDATE notes SET body = body RETURNING 1) SELECT count(*) AS updated FROM u;
 updated 
---------
       1
(1 row)

-- (on projects alice can see Beta but may not write it: the unqualified
-- UPDATE reaches Beta and the trigger refuses — loud, as writability is)
SELECT count(*) AS visible FROM projects;
 visible 
---------
       2
(1 row)

WITH u AS (UPDATE projects SET status = status RETURNING 1) SELECT count(*) AS updated FROM u;
ERROR:  letter: UPDATE denied on "public.projects" column "status" for user "a0000000-0000-0000-0000-000000000001" — requires 'update' privilege
SELECT * FROM truth() WHERE tbl = 'projects';
   tbl    |                  id                  |   a   |   b    
----------+--------------------------------------+-------+--------
 projects | b0000000-0000-0000-0000-000000000001 | Alpha | active
 projects | b0000000-0000-0000-0000-000000000002 | Beta  | draft
 projects | b0000000-0000-0000-0000-000000000003 | Gamma | done
(3 rows)

-- ============================================================
-- 3. SET reads a hidden column: NULL is written (D2).
-- ============================================================
UPDATE notes SET body = extra WHERE id = 'c0000000-0000-0000-0000-000000000001';
SELECT * FROM truth() WHERE tbl = 'notes';
  tbl  |                  id                  | a  | b  
-------+--------------------------------------+----+----
 notes | c0000000-0000-0000-0000-000000000002 | n2 | x2
 notes | c0000000-0000-0000-0000-000000000003 | n3 | x3
 notes | c0000000-0000-0000-0000-000000000001 |    | x1
(3 rows)

UPDATE notes SET body = 'n1' WHERE id = 'c0000000-0000-0000-0000-000000000001';
-- ============================================================
-- 4. RETURNING is redacted, on UPDATE, DELETE and INSERT (D4).
-- ============================================================
UPDATE notes SET body = 'n1!' WHERE id = 'c0000000-0000-0000-0000-000000000001'
    RETURNING body, extra, extra IS NULL AS extra_hidden;
 body | extra | extra_hidden 
------+-------+--------------
 n1!  |       | t
(1 row)

INSERT INTO notes (project_id, body, extra)
    VALUES ('b0000000-0000-0000-0000-000000000001', 'new', 'x-new')
    RETURNING body, extra;
 body | extra 
------+-------
 new  | 
(1 row)

DELETE FROM notes WHERE body = 'new' RETURNING body, extra;
 body | extra 
------+-------
 new  | 
(1 row)

SELECT * FROM truth() WHERE tbl = 'notes';
  tbl  |                  id                  |  a  | b  
-------+--------------------------------------+-----+----
 notes | c0000000-0000-0000-0000-000000000001 | n1! | x1
 notes | c0000000-0000-0000-0000-000000000002 | n2  | x2
 notes | c0000000-0000-0000-0000-000000000003 | n3  | x3
(3 rows)

-- and the value really was stored
SET letter.bypass = on;
SELECT extra FROM notes WHERE id = 'c0000000-0000-0000-0000-000000000001';
 extra 
-------
 x1
(1 row)

SET letter.bypass = off;
-- ============================================================
-- 5. ON CONFLICT: the WHERE cannot see hidden columns, SET cannot
--    read them.
-- ============================================================
INSERT INTO notes (id, project_id, body)
    VALUES ('c0000000-0000-0000-0000-000000000001', 'b0000000-0000-0000-0000-000000000001', 'dup')
    ON CONFLICT (id) DO UPDATE SET body = EXCLUDED.body WHERE notes.extra = 'x1';
INSERT INTO notes (id, project_id, body)
    VALUES ('c0000000-0000-0000-0000-000000000001', 'b0000000-0000-0000-0000-000000000001', 'dup')
    ON CONFLICT (id) DO UPDATE SET body = notes.extra
    RETURNING body;
 body 
------
 
(1 row)

SELECT * FROM truth() WHERE tbl = 'notes';
  tbl  |                  id                  | a  | b  
-------+--------------------------------------+----+----
 notes | c0000000-0000-0000-0000-000000000002 | n2 | x2
 notes | c0000000-0000-0000-0000-000000000003 | n3 | x3
 notes | c0000000-0000-0000-0000-000000000001 |    | x1
(3 rows)

UPDATE notes SET body = 'n1' WHERE id = 'c0000000-0000-0000-0000-000000000001';
-- The arbiter names ordinary (redacted) columns: inference must still find
-- the unique index (plan/21 story 9 found it did not).
INSERT INTO notes (project_id, body)
    VALUES ('b0000000-0000-0000-0000-000000000001', 'n1')
    ON CONFLICT (project_id, body) DO UPDATE SET extra = 'upserted'
    RETURNING body, extra;
 body | extra 
------+-------
 n1   | 
(1 row)

SELECT * FROM truth() WHERE tbl = 'notes';
  tbl  |                  id                  | a  |    b     
-------+--------------------------------------+----+----------
 notes | c0000000-0000-0000-0000-000000000001 | n1 | upserted
 notes | c0000000-0000-0000-0000-000000000002 | n2 | x2
 notes | c0000000-0000-0000-0000-000000000003 | n3 | x3
(3 rows)

UPDATE notes SET extra = 'x1' WHERE id = 'c0000000-0000-0000-0000-000000000001';
-- An upsert that conflicts with a row alice cannot see (Beta's note) is
-- refused (plan/24 A4): rows she cannot see are not there for UPDATE, and
-- the unique violation would have revealed the row anyway — whatever the
-- statement's own WHERE says, constant or not. DO NOTHING on the same
-- conflict is what it says. A conflict with a visible row still updates it,
-- the statement's own WHERE included.
INSERT INTO notes (id, project_id, body)
    VALUES ('c0000000-0000-0000-0000-000000000002', 'b0000000-0000-0000-0000-000000000001', 'take over')
    ON CONFLICT (id) DO UPDATE SET body = EXCLUDED.body;
ERROR:  letter: INSERT … ON CONFLICT DO UPDATE on "public.notes" conflicts with a row the user cannot see
INSERT INTO notes (id, project_id, body)
    VALUES ('c0000000-0000-0000-0000-000000000002', 'b0000000-0000-0000-0000-000000000001', 'take over')
    ON CONFLICT (id) DO UPDATE SET body = EXCLUDED.body WHERE notes.body = 'n2';
ERROR:  letter: INSERT … ON CONFLICT DO UPDATE on "public.notes" conflicts with a row the user cannot see
INSERT INTO notes (id, project_id, body)
    VALUES ('c0000000-0000-0000-0000-000000000002', 'b0000000-0000-0000-0000-000000000001', 'take over')
    ON CONFLICT (id) DO UPDATE SET body = EXCLUDED.body WHERE false;
ERROR:  letter: INSERT … ON CONFLICT DO UPDATE on "public.notes" conflicts with a row the user cannot see
INSERT INTO notes (id, project_id, body)
    VALUES ('c0000000-0000-0000-0000-000000000002', 'b0000000-0000-0000-0000-000000000001', 'take over')
    ON CONFLICT (id) DO NOTHING;
INSERT INTO notes (id, project_id, body)
    VALUES ('c0000000-0000-0000-0000-000000000001', 'b0000000-0000-0000-0000-000000000001', 'mine')
    ON CONFLICT (id) DO UPDATE SET body = EXCLUDED.body WHERE notes.body = 'n1'
    RETURNING body;
 body 
------
 mine
(1 row)

SELECT * FROM truth() WHERE tbl = 'notes';
  tbl  |                  id                  |  a   | b  
-------+--------------------------------------+------+----
 notes | c0000000-0000-0000-0000-000000000001 | mine | x1
 notes | c0000000-0000-0000-0000-000000000002 | n2   | x2
 notes | c0000000-0000-0000-0000-000000000003 | n3   | x3
(3 rows)

UPDATE notes SET body = 'n1' WHERE id = 'c0000000-0000-0000-0000-000000000001';
-- ============================================================
-- 6. UPDATE … FROM a protected table, and a sublink back to the
--    result relation. notes.project_id is the grant's path column
--    (visible, 17 D16) so the join finds alice's note; extra is
--    hidden, so the sublink on it finds nothing.
-- ============================================================
WITH u AS (UPDATE notes SET body = p.name FROM projects p WHERE p.id = notes.project_id RETURNING 1) SELECT count(*) AS updated FROM u;
 updated 
---------
       1
(1 row)

WITH u AS (UPDATE notes SET body = body || '?' WHERE EXISTS (SELECT 1 FROM projects p WHERE p.secret = notes.extra) RETURNING 1) SELECT count(*) AS updated FROM u;
 updated 
---------
       0
(1 row)

SELECT * FROM truth() WHERE tbl = 'notes';
  tbl  |                  id                  |   a   | b  
-------+--------------------------------------+-------+----
 notes | c0000000-0000-0000-0000-000000000001 | Alpha | x1
 notes | c0000000-0000-0000-0000-000000000002 | n2    | x2
 notes | c0000000-0000-0000-0000-000000000003 | n3    | x3
(3 rows)

-- ============================================================
-- 7. Whole-row references to the result relation are refused (D3).
-- ============================================================
UPDATE notes SET body = body RETURNING notes;
ERROR:  letter: a whole-row reference to the result relation is not supported on letter-protected table "public.notes"
UPDATE notes SET body = body RETURNING row_to_json(notes);
ERROR:  letter: a whole-row reference to the result relation is not supported on letter-protected table "public.notes"
-- ============================================================
-- 8. One prepared statement, two users.
-- ============================================================
PREPARE u AS UPDATE notes SET body = body RETURNING body, extra;
EXECUTE u;
 body  | extra 
-------+-------
 Alpha | 
(1 row)

SET letter.user_id = 'a0000000-0000-0000-0000-000000000002';
EXECUTE u;
 body | extra 
------+-------
(0 rows)

DEALLOCATE u;
-- ============================================================
-- 9. A select-grant if in the write path (plan/20 §3): tickets are
--    visible to editors while open. A closed ticket is not there for
--    UPDATE or DELETE; closing one is the last thing an editor does to it.
-- ============================================================
SET letter.bypass = on;
CREATE TABLE tickets (
    id uuid PRIMARY KEY,
    project_id uuid NOT NULL REFERENCES projects(id),
    title TEXT,
    state TEXT
);
CREATE INDEX ON tickets (project_id);
INSERT INTO tickets VALUES
    ('e0000000-0000-0000-0000-000000000001', 'b0000000-0000-0000-0000-000000000001', 't1', 'open'),
    ('e0000000-0000-0000-0000-000000000002', 'b0000000-0000-0000-0000-000000000001', 't2', 'closed');
SELECT letter.grant_scoped('select', 'public.tickets', 'editor', ARRAY['*'], 'public.projects', if := 'state = ''open''');
 grant_scoped 
--------------
 t
(1 row)

SELECT letter.grant_scoped('update', 'public.tickets', 'editor', ARRAY['title', 'state'], 'public.projects');
 grant_scoped 
--------------
 t
(1 row)

SELECT letter.grant_scoped('delete', 'public.tickets', 'editor', ARRAY['*'], 'public.projects');
 grant_scoped 
--------------
 t
(1 row)

SET letter.bypass = off;
SET letter.user_id = 'a0000000-0000-0000-0000-000000000001';
SELECT title, state FROM tickets ORDER BY title;
 title | state 
-------+-------
 t1    | open
(1 row)

UPDATE tickets SET title = title || '!' RETURNING title;                 -- t2 is not there
 title 
-------
 t1!
(1 row)

DELETE FROM tickets WHERE state = 'closed';                              -- nothing to delete
UPDATE tickets SET state = 'closed' WHERE title = 't1!' RETURNING title, state;   -- allowed; the row returned is already hidden
 title | state 
-------+-------
       | 
(1 row)

UPDATE tickets SET title = 'again' RETURNING title;
 title 
-------
(0 rows)

SET letter.bypass = on;
SELECT title, state FROM tickets ORDER BY title;
 title | state  
-------+--------
 t1!   | closed
 t2    | closed
(2 rows)

DROP TABLE tickets;
NOTICE:  letter: dropped table public.tickets: removed 4 grant(s), 0 rule(s), 0 membership(s)
SET letter.bypass = off;
\set VERBOSITY default
-- Cleanup
RESET letter.user_id;
RESET letter.enforce_reads;
DROP FUNCTION truth();
DROP TABLE team_members, notes, projects, users CASCADE;
NOTICE:  letter: dropped table public.projects: removed 10 grant(s), 1 rule(s), 0 membership(s)
DROP EXTENSION letter CASCADE;
